Datetime,Text
2022-05-08,what do you think love leagueoflegends visit us com
2022-05-08,leagueoflegends
2022-05-08,league of legend
2022-05-08,i would like to see a mod about the characters from leagueoflegends ngl would be interesting to see ornn against volibear in a rapbattle
2022-05-08,hewwo any leagueoflegends players wanna play later add angelina
2022-05-08,aphelios from leagueoflegends
2022-05-08,leagueoflegends
2022-05-08,leagueoflegends pfp
2022-05-08,i feel like we need to stop talking about leagueoflegends and start talking about the current socioeconomic state of the world
2022-05-08,so is this how it is going to go forever i am plat support player for that last years or so playing from season getting honor every season as a respectable league player
2022-05-08,logicool g lol k da pro leagueoflegends gx lightsync rgb
2022-05-08,if you are a sigma female i am a omega male looking for a cool girl to play leagueoflegends with
2022-05-08,ty for making the skinline where it gave my meaning to the
2022-05-08,to the fans of thank you for your continued support you are in a league of i hope we did your legends justice see you soon with another legend x
2022-05-08,u forgot that we are on leagueoflegends twitter
2022-05-08,did you say leagueoflegends i want more league friends
2022-05-08,war of xazory leagueoflegends crossed with dark souls but much more challenging
2022-05-08,give camille a crime city or debonair skin
2022-05-08,dpr live song for leagueoflegends
2022-05-08,i am not good at this whole flirting bsi do nothing all day but gym and leagueoflegends
2022-05-08,under the influence of epic gaming
2022-05-08,sometimes i play senna and am reminded that i am the greatest leagueoflegends player in our current society
2022-05-08,bro i hope they fucking make adc playable not have people pick adc turret dive level rape champs
2022-05-08,i also accept leagueoflegends
2022-05-08,the case jv rocket league legends won their last match of the season vs la follette last week congratulations on an undefeated season so proud of everyone
2022-05-08,what is this thing and why is it in my leagueoflegends timeline
2022-05-08,privilege is why arteta gets the job ahead of a legend like vieira do i need to remind you that they are both in the same league but not mates when it comes to table positions go figure
2022-05-08,from leagueoflegends this is a joke lnjdwnmwdm
2022-05-08,the schedule for the leagueoflegends summer split has been revealed with proceedings to commence on june the post
2022-05-08,tealz will return on the th to the leagueoflegends wild rift with lots of libido and love for all genders colors and sizes
2022-05-08,pov average league of legend player
2022-05-08,leagueoflegends
2022-05-08,i really think riot and leagueoflegends reporters need to update north america s flag
2022-05-08,leagueoflegends video post valorant a strategy game that gives instructions to soldiers in real time click the link below to watch now
2022-05-08,mass effect is my absolute favorite i was so emotionally drawn to the story and characters leagueoflegends cod in terms of competitive gaming
2022-05-08,leagueoflegends stream in less than an hour
2022-05-08,i ve enjoying leagueoflegends lately
2022-05-08,anyone who disagrees can hang
2022-05-08,wait rly which ones have u won except leagueoflegends
2022-05-08,do any sweet fellow leagueoflegends players wanna gift me arcana xayah
2022-05-08,leagueoflegends durability update patch
2022-05-08,leagueoflegends
2022-05-08,you play leagueoflegends
2022-05-08,no
2022-05-08,idk who needs to hear this but leagueoflegends has hundreds of songs that u can use for free in videos and of them are bangers
2022-05-08,anything except leagueoflegends
2022-05-08,explain in leagueoflegends terms
2022-05-08,gonna play the hit game leagueoflegends and try not to end it all
2022-05-08,some vs action here in leagueoflegends semis winner to championship
2022-05-08,is leagueoflegends down why leagueoflegends is not working today whats up with leagueoflegends now of legends of legendsdown
2022-05-08,this man should be hailed as a milan legend if he wins them the league he is dragged them over the line in so many games at years of age
2022-05-08,time for stream we playing leagueoflegends and maybe some more crew we ll decide based on how the matches go
2022-05-08,just uninstalled leagueoflegends where the sexy bitches at
2022-05-08,user reports indicate leagueoflegends is having problems since pm edt rt if you are also having problems
2022-05-08,i am about to play to get away from the toxicity of social media that s sad
2022-05-08,chill stream today to start just going to be rocking some ranked games on leagueoflegends maybe i will see you there twitch x soules
2022-05-08,leagueoflegends
2022-05-08,he s not a legend end of can t have one league title at a team like united and be classed as a legend de gea does not even touch the sides of schmichael or van der saar
2022-05-08,happy to the only mom in all of leagueoflegends
2022-05-08,why did i wake up today and decide to play leagueoflegends
2022-05-08,i play to league of legend oh la con
2022-05-08,caitlyn and vi arcane leagueoflegends
2022-05-08,ah no leagueoflegends entr al chat
2022-05-08,leagueoflegends because i am addicted to it
2022-05-08,how old do you think he is mate and arsenal had still won league titles by then so a switch from luton is still plastic and glory hunting there s also been so many instances where he is been plastic e g calling cass pennant a legend and encouraging the abuse of players
2022-05-08,legends of this league
2022-05-08,he seems in the league of real legends not pretender
2022-05-08,what does cc stand for crowd control i play leagueoflegends and therefore have no friends
2022-05-08,prolific goalscoerer and bohs legend between johnny mcdonnell played for ireland at full and amateur level as well as representing the irish league definitely a repesentative jersey of some kind going to take a punt of irish league
2022-05-08,sona now the best enchanter in league oflegends
2022-05-08,her name is yuumi like the leagueoflegends character only months old just a baby
2022-05-08,happy to do so again sometime i just finished watching arcane season i know late to the boat but bloody great show got me looking at leagueoflegends now
2022-05-08,leagueoflegends xd
2022-05-08,omg they added a leagueoflegends tab what
2022-05-08,is there any safe places to play leagueoflegends esports bet
2022-05-08,hey kid twitter was supposed to be you should not lie just to get onto twitter also the destiny community is thee most toxic place on earth next to the leagueoflegends community and then warframe
2022-05-08,because leagueoflegends is not availble on console yet the minute it is i will be moving straight to it i play on phone but phone gaming is terrible
2022-05-08,even leagueoflegends has watch the game reply guys
2022-05-08,if people are so concerned how about stop playing fortnite or warzone and leagueoflegends
2022-05-08,go back to playing leagueoflegends and getting no bitches
2022-05-08,the leagueoflegends tag is real where was this when i was on there
2022-05-08,which one
2022-05-08,sorry ladies i cannot have sex with all of you i am too busy playing leagueoflegends this is a cry for help
2022-05-08,doot without leagueoflegends
2022-05-08,i see so it is sort of like leagueoflegends with unlocking people
2022-05-08,check out my play recorded by desktop app for
2022-05-08,when i told my cousin her name he thought you named her after a character from leagueoflegends
2022-05-08,we are getting no hit by someone who plays leagueoflegends
2022-05-08,minecraft and gta leagueoflegends is shit in my opinion valorant is boring as shit halo is good but old rocket league is overrated havent played elden ring im good at fortnite but quit for months im still away from it but the game is absolutely ass fortnite is shit
2022-05-08,of course the legend that could not win one premier league in his career says that
2022-05-08,still live switched to leagueoflegends
2022-05-08,can he get an asu now
2022-05-08,leagueoflegends prodigy
2022-05-08,leagueoflegends
2022-05-08,kevin de bruyne will retire in english football as one of the best players to have ever graced the epl premier league legend status cemented
2022-05-08,unfortunately aisha caught me at the end of my leagueoflegends career i am old and washed up and my hands are not as fast as they once were
2022-05-08,whats wrong with my leagueoflegends i cannot play duo with friends cuz its say i have old version
2022-05-08,big changes in leagueoflegends gameplay in patch via
2022-05-08,ahem samira leagueoflegends thank you for coming to my ted talk
2022-05-08,logicool g lol k da pro leagueoflegends gx lightsync rgb
2022-05-08,nft s are not games that s like looking at a leagueoflegends skin and saying well games are better than this skin cause you can play the game
2022-05-08,koikatsu party leagueoflegends roblox golf with friends apex legends college kings
2022-05-08,leagueoflegends video post valorant a strategy game that gives instructions to soldiers in real time click the link below to watch now
2022-05-08,leagueoflegends jk
2022-05-08,genshin impact leagueoflegends honkai impact kpop stray kids txt enhypen ateez the boyz itzy
2022-05-08,would be interesting to see what would happen to f p games like leagueoflegends would they benefit more from nd market sales in royalties it would lower in game purchases because of the ability to trade where they would get of the sale
2022-05-08,leagueoflegends is my comfort game totally recommend
2022-05-08,ay yo some gay representation would be pretty dope i like his base skin but i think if they just made him look cleaner it would be even better but i am not against a gay pride varus skin tbh gt gt
2022-05-08,this woman mentally and emotionally terrorized us women s hoops legend cynthia cooper dyke at center of probe into allegations of abuse of players the shadow league
2022-05-08,she s bisexual in leagueoflegends universe and straight in the arcane universe
2022-05-08,an independent portrayal of league of legend s ahri mdni writer is multiship with chemistry pansexual
2022-05-08,bro you gotta add that i am gm in leagueoflegends whenever you talk about my god gamer status
2022-05-08,took some time off of social media to enjoy offseason to the fullest but i got to say boy do i miss shouting at some good fucking leagueoflegends if anyone would like to vod review together or just have a chat about casting my dm s are always open dutch and english
2022-05-08,no happy birthday if he still has that outdated voiceover update it already you said you would years ago along with mf who is gotten two high tier skins since then and her actual canon character still has her basic skank vo
2022-05-08,warriors leagueoflegends cinematic
2022-05-08,mama wants cold hard cash
2022-05-08,n no i didnt spend all this money in leagueoflegends shut up
2022-05-08,like and share if you have been fan since day love leagueoflegends visit us com
2022-05-08,leagueoflegends friends sentiment and toxicity read
2022-05-08,i am streaming leagueoflegends wild rift come hang out powered by
2022-05-08,arcane league of arcane legends arcane
2022-05-08,i do not really think of it as a decline it s age kicking in the club as had the best of him and now he needs to play a slower league so the barca thing is perfect for him his a bridge legend
2022-05-08,i cannot believe i am saying this but leagueoflegends is kind of amazing i ts almost like it was created by steve jobs
2022-05-08,leagueoflegends i am taking off my application have a good day madam
2022-05-08,leagueoflegends durability update makes every character tankier
2022-05-08,i am streaming leagueoflegends wild rift come hang out powered by
2022-05-08,riot games leagueoflegends
2022-05-08,i need new gaming buddies mutuals rt s appreciated i enjoy play shin megami tensei persona leagueoflegends apex legends pokemon go kirby elden ring paladins nice to meet yall
2022-05-08,i am now streaming on twitch playing leagueoflegends
2022-05-08,today was my final day on the casting desk for year two in the past three days i commentated games of apex legends for emea and na lcq s huge thanks for the support this season we ll make it to pro league broadcast
2022-05-08,there are other games to play i can play games that are not leagueoflegends
2022-05-08,add batman skins
2022-05-08,the leagueoflegends effect at it is finest
2022-05-08,anime leagueoflegends valorant genshin impact gf
2022-05-08,pov you are wonderimiya playing leagueoflegends
2022-05-08,from the academy fresh faced via league playoff shenanigans league champions and a steadiness in the championship legend jordan he is one of our own
2022-05-08,leagueoflegends has taken over my life
2022-05-08,it s not me in the pic i legti have no clue abt cars it is a leagueoflegends streamer youtuber
2022-05-08,we are excited to announce the arrival of contsem to our leagueoflegends roster as our new assistant manager please welcome
2022-05-08,lolzz cannot forget one of the worst days of united fans but what a way to win the league wonder if we will see something like that again agureo s a legend
2022-05-08,leagueoflegends
2022-05-08,if you are saying mages and supports are useless you just cannot play them i play adc s but as soon as xerath or soraka pops up in aram i take it instantly soraka healing k in a match xerath deleting enemy carries screens away and that is just the i can play
2022-05-08,im kinda mad that prom made me miss out on leagueoflegends time
2022-05-08,definitely leagueoflegends crossover incoming
2022-05-08,worst day of leagueoflegends is better than the best day of being a follower
2022-05-08,buy them here making a few customs inspired by leagueoflegends characters this week
2022-05-08,who remembers that love leagueoflegends visit us com
2022-05-08,happy birthday demon pants
2022-05-08,probably the most wholesome thing imaginable
2022-05-08,so many crypto and legends now part of x league founded by and many more but who was the first to buy a team yea its the and only cheers
2022-05-08,yes actually type i in all chat hehexd
2022-05-08,ap twitch players rejoice
2022-05-08,our leagueoflegends summer split applications are now open first wave sat may th second wave sat may th final deadline sun may th at pmpt apply early to receive feedback good luck summoners
2022-05-08,leagueoflegends epic gaming session
2022-05-08,live noob player back in league leagueoflegends via
2022-05-08,the worst day of fishing still beats the best day of leagueoflegends
2022-05-08,leagueoflegends and r
2022-05-08,leagueoflegends and dead by daylight discord instagram twitter
2022-05-08,leagueoflegends stream on twitch pm pdt
2022-05-08,hello guys i play leagueoflegends
2022-05-08,leagueoflegends
2022-05-08,happy birthday tavvy aka heatseeker player aka leagueoflegends top laner aka terrible at rl v s
2022-05-08,source mathu s musings is patch the second golden age for leagueoflegends
2022-05-08,leagueoflegends video post valorant a strategy game that gives instructions to soldiers in real time click the link below to watch now
2022-05-08,leagueoflegends for sure
2022-05-08,mfs
2022-05-08,i vaguely remember some kind of research about male vs female leagueoflegends players something about the differences between m amp f brains where men were more able to focus on details and micro whereas females had higher potential for macro play
2022-05-08,hi remember this
2022-05-08,mom types lmao stop with the mentally ill speak
2022-05-08,i think a nice birthday present would be a vgu
2022-05-08,dylan and i at a historic fort off the coast of charleston dylan i wonder if i could play leagueoflegends from here
2022-05-08,and where is his chat where do i click i disagree cause he started out being toxic cause he lost lane and blame it on me cause i was winning the game with the rest of the team really riot there are people afking saying report me nothing happens
2022-05-08,the leagueoflegends client has got to be the most disgusting client out of any modern game ever it just has to there is no way there is a game client worse than it i would not believe it
2022-05-08,leagueoflegends
2022-05-08,is it the darkin s birthday or one of the two hunters spirits inside him birthday
2022-05-08,i have peaked in life and leagueoflegendswhat more could a woman want
2022-05-08,money aside brand aside the kid needs to ask himself one thing do you want to keep playing in a farmers league or do you want to write your name in history with real madrid along with the greats of all time become a legend with rm or keep plowing the same field with psg
2022-05-08,leagueoflegends personalities
2022-05-08,i never thought i would be playing leagueoflegends bc it is not my style but arcane did something to me
2022-05-08,leagueoflegends
2022-05-08,can you please buy riotgames and delete leagueoflegends the world would be better
2022-05-08,you re killing me with nunu
2022-05-08,asu when
2022-05-08,there are leagueoflegends players spending mother s day queueing up for consecutive hours instead of hanging out with the mother they perma leech from
2022-05-08,hi i wanted to do a little poll contest thingie where we all elect the hardest champion in leagueoflegends criteria are mechanics and skill map awareness needed can u comeback outscaled etc be really objective the champs will be selected at random for v
2022-05-08,do we have to redo every single one of these if done in the past since nothing was tracking it or we just get it as completed right away
2022-05-08,now playing this jam enemy from the series arcane leagueoflegends commercial free always
2022-05-08,hijacking leagueoflegends accounts a tale of stealing from chinese boosters and their win trading accounts
2022-05-08,because neymar never rises to the occasion that s not a double standard at all some players like shakeri a legend like klopp cannot bring the best of and the best of neymar is winning the french league times in a row and missing against neuer
2022-05-08,she s not gonna fuck you dude
2022-05-08,don t forget kayle s mom
2022-05-08,it s am here but i think i can go for hours leagueoflegends as always at
2022-05-08,leagueoflegendspvp
2022-05-08,keep the icons but remove the chat disable thing
2022-05-08,are you sure
2022-05-08,i know i have hit my breaking point when my go to game has become leagueoflegends
2022-05-08,now that my novella draft is done it is time to reinstall leagueoflegends because apparently i am a masochist
2022-05-08,playing roblox and leagueoflegends on mothers day have some shame
2022-05-08,stream up more climbing and learning
2022-05-08,your artist valorant my artist leagueoflegends
2022-05-08,high noon leona skin spotlight league oflegends
2022-05-08,edg zoe skin spotlight league oflegends
2022-05-08,my leagueoflegends addiction
2022-05-08,i showed my boobs to a leagueoflegends player and ur my third so that has to be you and im a lol player and i dont have a pic of ur tits so happy mothers dayyaysyay
2022-05-08,what a great idea
2022-05-08,lmk let me know omw on my way brb be right back lol laugh out loud or league of legend nfa not financial advice wdym what do you mean ama ask me anything hbu how about you idk i dont know j j join for join s s stay for stay
2022-05-08,get rid of your bushes they are not skillful and i am annoyed at the nerds that sit in them and then jump out on me cos they cant take a fair fight
2022-05-08,edg viego skin spotlight league oflegends
2022-05-08,edg graves skin spotlight league oflegends
2022-05-08,edg yuumi skin spotlight league oflegends
2022-05-08,leagueoflegends wild rift
2022-05-08,sting what could have been arcane leagueoflegends
2022-05-08,edg aphelios skin spotlight league oflegends
2022-05-08,why is korean rengar the highest winrate in the entire game league oflegends
2022-05-08,me playing leagueoflegends
2022-05-08,fix your dog shit game letting stupid ass sion players run it down you brain broken shitters
2022-05-08,i am happy to announce that i joined as head of leagueoflegends looking forward to work with you guys and achieve great goals
2022-05-08,also what does that have to do with what i said why be transphobic under a league of legend tweet
2022-05-08,kills literally every look
2022-05-08,yeah me too lol if i had the money i would like not do that and spend it on stuff i like instead but you know how it is many people are almost comically self destructive leagueoflegends is the most popular pc game in the world
2022-05-08,back off of your tower thats just asinine under tower pre should be the safest place in the lane and no they dont really lose that much gold they get for the kill and for an assist x thats gold they got they may have missed waves which is less
2022-05-08,oh yeah of course he would be a good mentor for the ones that ll come i am sure of it but dude he has to make the ultimate sacrifice the club that made him a legend or his career of not being in the champions league and probably become a super sub
2022-05-08,what jinx from
2022-05-08,pentakill interesting fact i do not play leagueoflegends
2022-05-08,soogyu plays leagueoflegends i just know they cuss
2022-05-08,to leeds united legend and member of england s world cup winning squad jack charlton who would have turned today charlton spent his entire club career with helping the club to the first division title fa cup and league cup
2022-05-08,is leagueoflegends part of that list if so that is probably what arcane is for
2022-05-08,city needed a win that game to win their first league title in almost years and they were drawing with minutes of injury time down he scored a goal and it wad his first season which won them the league then over the next years he made a legend out of himself
2022-05-08,have u ever played leagueoflegends while watching anime and thinking of valorant cause same gt
2022-05-08,lol leagueoflegends
2022-05-08,it started with our monkey legends pulling two fortune cookies at lunch time which basically had bravier daddy s initials a bike and the universal sign of healing the star then i got a note from a snobish ivy league which informed me that they want me to teach a course
2022-05-08,i was checking some old cancelled leagueoflegends skins and there was supposed to be a rick roll rick astley ezreal skin wtf why
2022-05-08,couldn t be more excited to announce that kelly smith will be playing in saturday s charity match caps and goals for england mbe champions league winner team gb olympics a true legend of the game berkhamsted fc on saturday ko
2022-05-08,leagueoflegends wild rift
2022-05-08,when udyr please answer
2022-05-08,great job riot
2022-05-08,leagueoflegends been running twitch forever but i is not never ever seen anyone play it in irl or even talk about games looks confusing to even know what is going on
2022-05-08,i love lux from leagueoflegends
2022-05-08,i thought leagueoflegends was full of dumb people on the internet but nft s and crypto had showed me there are even more on the web why do not people listen or do research even with their own money web money is not the same as your favourite mmorpg money it is real
2022-05-08,leagueoflegends players getting bitches
2022-05-08,leagueoflegends durability update will make every character harder tokill
2022-05-08,if you go by hours played it is diablo world of warcraft or leagueoflegends
2022-05-08,was playing sum leagueoflegends wild rift lel
2022-05-08,rodgers has ran out of steam the team is at the end of an era time to be brave and say goodbye and thank you to our legends such as schmeichel vardy and albrighton we are going backwards in the premier league
2022-05-08,i have never heard of a mom type pokemon did they add that recently
2022-05-08,your hono r league of legend s
2022-05-08,brainless decision
2022-05-08,no you play leagueoflegends
2022-05-08,leagueoflegends lvate porfavor
2022-05-08,i have a question do you play yuumi in leagueoflegends
2022-05-08,my top games no order cs go leagueoflegends europa universalis iv skyrim starcraft ii all of em warcraft i borderlands ii grand theft auto v final fantasy x age of empires ii
2022-05-08,what do u mean ingame money
2022-05-08,you can invite as well and three of you can form a group just like how you play in league of legend which is called tli toast lily ivone tli means three little idiots bye please do not stab me
2022-05-08,leagueoflegends video post valorant a strategy game that gives instructions to soldiers in real time click the link below to watch now
2022-05-08,the only mother in league really
2022-05-08,come check out streaming of legends on now show the love at
2022-05-08,hype pra real challenges walkthrough leagueoflegends
2022-05-08,stop giving knowledge check champs free wins leagueoflegends via
2022-05-08,the arsenal legends of the double winners who won the league at tottenham s white hart lane were honoured at half time at the emirates stadium today
2022-05-08,leagueoflegends
2022-05-08,nice outfit beautiful woman
2022-05-08,yeah i agree role queue was the healthiest thing for the game and i believe ranked leagueoflegends does it too not like it is an ow specific thing but if you are really casual and playing with friends and everyone wants to dps why not let them in qp i guess not like it matters
2022-05-08,i am just an old lady playing leagueoflegends on a sunday morning
2022-05-08,it is about the leagueoflegends world basically just transformed into an mmo
2022-05-08,live leagueoflegends are we the best or worst
