Datetime,Text
2022-05-08,i was the leagueoflegends guy
2022-05-08,the most entertaining leagueoflegends content is when people get super tilted and angry ie tyler explaining how bad his teamates are is funny asf sro has the funniest rage montage valkin flaming humzh and i think that says a lot about league
2022-05-08,yes the tower is the safest place in lane but it is not completely infallible and i do not think it should be i do not think saying that is asinine yes you can back off a turret sacrificing waves to deny kill assist gold is not the end of the world
2022-05-08,we need to collectively obliterate leagueoflegends from our society
2022-05-08,potatoise arcane leagueoflegends
2022-05-08,live ranked leagueoflegends rn
2022-05-08,let me ask you why should i care can you play satisfactory can you play phasmophobia can you play counter strike can you play leagueoflegends on your precious playstation of course no and why should you care
2022-05-08,can we make it so that when shelly is summoned and a team choses to tower dive target lane with shelly the tower only targets shelly this would increase value for shelly imo
2022-05-08,leagueoflegends
2022-05-08,leagueoflegends
2022-05-08,leagueoflegends video post valorant a strategy game that gives instructions to soldiers in real time click the link below to watch now
2022-05-08,live playing some leagueoflegends with the homies maybe some flex queue
2022-05-08,r
2022-05-08,cruyff won barca their first league title in years humiliating madrid season after season became manger and won barca league titles in a row reaching ucl s finals as well so to even include cruyff in that list of not being a legend at barca is laughable
2022-05-08,live schedule leagueoflegends
2022-05-08,would you guys chill in stream with me if i streamed leagueoflegends tonight and we talked ygo
2022-05-08,thanks everyone who stopped by my stream today nearly ranked gold in leagueoflegends also almost affiliate on twitch
2022-05-08,i have just been bullied to the point of tears by elshamus thereaperofmarz chronobunny jcthemann obviavi antoinebonjour archie falls on leagueoflegends
2022-05-08,should be interesting to see rookie shakira austin matchup with legend sylvia fowles tonight will fowles welcome her to the league with one of her dominant performances or can austin keep up
2022-05-08,leagueoflegends or fifa
2022-05-08,seraphine leagueoflegends
2022-05-08,day of asking to make yasuo a jungler q dmg buff to jungle camps ez
2022-05-08,pls put on back the nexus blitz mod me and my friends love it and we juste wait this
2022-05-08,leagueoflegends is bad
2022-05-08,logicool g lol k da pro leagueoflegends gx lightsync rgb
2022-05-08,i would not trust that frames but for most of the numbers being thrown around it is probably fine just keep in mind that ms ping in leagueoflegends will feel like ms in a web browser today so you have even less of a budget to feel fast
2022-05-08,i have accidentally typed leagueoflegends as my username twice today in the league launcher
2022-05-08,day no leagueoflegends
2022-05-08,kindred enthusiast leagueoflegends account discord server
2022-05-08,hey guys i have decided to start leagueoflegends again i will be coming back as a kayn jungle main i hope you can all support this decision
2022-05-08,arcane leagueoflegends series don t look up movie
2022-05-08,imagine dragons x j i d enemy from the series arcane leagueoflegends via
2022-05-08,same guy who plays leagueoflegends alone
2022-05-08,joke s on them i play leagueoflegends that is like goku training in the hyperbolic time chamber for this game
2022-05-08,so like make him gay
2022-05-08,jinx
2022-05-08,i am now streaming on twitch playing leagueoflegends
2022-05-08,eyy real nice of you king
2022-05-08,sona from leagueoflegends
2022-05-08,couple of league legends in there what a family
2022-05-08,volibear is a beast recorded by
2022-05-08,literally why i started playing leagueoflegends
2022-05-08,high noon mordekaiser skin spotlight league oflegends
2022-05-08,leagueoflegends aram
2022-05-08,great stream today first win weekend league of the year sadly rewards were not worth it and that dupe casillas from the moments pack was a heartbreaker appreciate the love lately though you are all legends
2022-05-08,vi leagueoflegends i am on thursday night if you would like to hang out i am free on thursday night when i am free
2022-05-08,i really hope viktor on leagueoflegends arcane is not going to b e a villain just because he walks with a cane
2022-05-08,leagueoflegends top streams a las hora esp th antonioviewers xixauxasviewers
2022-05-08,leagueoflegends road to gold
2022-05-08,what videogame would you like to star in leagueoflegends
2022-05-08,i would never forget you lt
2022-05-08,is not it like pokmon leagueoflegends
2022-05-08,i have such a love hate relationship with i love the game it hates me and matches me with people who are actually good at the game every time
2022-05-08,the usual streaming some leagueoflegends with kelgateskollections
2022-05-08,yes
2022-05-08,vs it is finally here the leagueoflegends mid season
2022-05-08,leagueoflegends grind ranked
2022-05-08,you should join the discord in case
2022-05-08,yh well idk ab u but followers or twitter career isnt something im trying to achieve but i understand that having followers that play leagueoflegends means a lot to you figured from ur vocabulary u either argue by mentioning followers or calling ppl random creative
2022-05-08,cont player legend and king of the kop scored for the th consecutive premier league match
2022-05-08,leagueoflegends live do oreinha via
2022-05-08,gta v and leagueoflegends
2022-05-08,osman has been streaming leagueoflegends for minutes and no one s watching them go say hi and make their day tag your favourite leagueoflegends streamer
2022-05-08,leagueoflegends pff more like league of dodges
2022-05-08,leagueoflegends
2022-05-08,solo alcohol y leagueoflegends
2022-05-08,pool party
2022-05-08,play leagueoflegends
2022-05-08,please welcome as our new tempest gaming main leagueoflegends manager looking forward to what this new and staffed roster can do for us as we look to make moves in summer proving grounds her twitch
2022-05-08,yo going live right now going to play a bit of leagueoflegends and then see what we get into after that new follower emotes and new overlays are live come by and vibe
2022-05-08,assist
2022-05-08,world of warcraft runescape no mans sky cod warzone cs go rocket league sea of thieves leagueoflegends overwatch apex legends dota final fantasy xiv and many more
2022-05-08,leagueoflegends o gta rp
2022-05-08,lol
2022-05-08,a photo with a league of ireland and legend
2022-05-08,if you ever want to beat me in leagueoflegends just play tristana because i will be half mast the whole game
2022-05-08,leagueoflegends video post valorant a strategy game that gives instructions to soldiers in real time click the link below to watch now
2022-05-08,power to him cuz if i ever become a dad the last thing my kids are touching is leagueoflegends
2022-05-08,gt leagueoflegends in gt my team has a tank
2022-05-08,you gotta respect how long rekkles has managed to stay relevant in the leagueoflegends scene its actually super impressive
2022-05-08,isso vs pink dragons h leagueoflegends
2022-05-08,leagueoflegends
2022-05-08,the thing about skins in leagueoflegends most of them are locked on a paywall where there is now choice but to whale spend money shame because there are a lot of nice skins for the champions i play wild rift recently
2022-05-08,your honor leagueoflegends
2022-05-08,i am sitting at this bar raging over a hockey game and josh is playing leagueoflegends on his phone
2022-05-08,jax pentakill leagueoflegends
2022-05-08,leagueoflegends
2022-05-08,i am now streaming on twitch playing leagueoflegends
2022-05-08,stream is gonna start at pm cdt instead of due to me needing to eat i am gonna play leagueoflegends with my hubby again
2022-05-08,omg my main in leagueoflegends i love them
2022-05-08,getting back into leagueoflegends was a mistake lol
2022-05-08,finally watched i really liked it also ended up playing again and it might just be me but when do i stop getting steamrolled by smurfs
2022-05-08,leagueoflegends is at it is peak because of the chat bug this is the most fun i have had in a long time
2022-05-08,i have a confession i have been in a love hate relationship leagueoflegends for years now every time i go back i have fun for games and then it makes me miserable
2022-05-08,cute but riot please remove red trinked from minion and super minons in aram
2022-05-08,leagueoflegends top streams a las hora esp th antonioviewers elbokeronviewers
2022-05-08,here s your weekly lineup pokemon social night leagueoflegends windjammers street fighter rocket league super smash bros ultimate guilty gear strive king of fighters and mario kart deluxe register today
2022-05-08,my hatred for gamers grows stronger everyday grown men whose hobbie is csgo or leagueoflegends deserve to be ostracized hopefully credit scores in the future take care of that
2022-05-08,wait is that sponsor friendly pro leagueoflegends player fudge what a stand up and socially aware guy i enjoy engaging with him in a parasocial environment
2022-05-08,apparently in leagueoflegends s auto chess mode teamfight tactics the game was already pretty balanced but people complained about popular character being op just because she was annoying so they just made a completely insignifcant nerf and people stopped playing her
2022-05-08,one billion games of leagueoflegends
2022-05-08,leagueoflegends
2022-05-08,leagueoflegends
2022-05-08,welcome back to bash bros sunday malcolm and and i are playing some leagueoflegends arams for some reason let s go
2022-05-08,seems like a good kid i hope he never finds out about leagueoflegends
2022-05-08,man i forgot how much fun leagueoflegends is i havent stopped playing lately
2022-05-08,there is nothing that makes me smile more than leagueoflegends account k be euw capsules email included buy now
2022-05-08,i am an honorable leagueoflegends
2022-05-08,apex legend or leagueoflegends
2022-05-08,i am now streaming on playing of legends stop by and chill
2022-05-08,out of leagueoflegends maybe
2022-05-08,when
2022-05-08,streaming leagueoflegends at pm est come hang out i got a new monitor set up tonight i am trying for the first time very excited
2022-05-08,do you know varus lore
2022-05-08,please welcome our summer season leagueoflegends staff team
2022-05-08,at this point riot is probably just taking the piss there is no way they have not already discussed how disgustingly clunky and bug ridden the client is but nothing s on the horizon so they will leave it as is until leagueoflegends comes out or something
2022-05-08,happy mother s day and happy st birthday to hall of famer and negro league legend turkey stearnes who flapped his arms like a turkey when he ran he worked in a detroit auto factory owned by the tigers owner but could not play for the team because of his race
2022-05-08,likes please love leagueoflegends visit us com
2022-05-08,are you afraid to misgender a fictional character
2022-05-08,chivas celebrates years of history today el rebao has seen great legends wear it is jersey and some unforgettable memories created can los rojiblancos get their th league title to celebrate this year
2022-05-08,play leagueoflegends or
2022-05-08,it s the leagueoflegends event
2022-05-08,managed to snatch more league title goals in games promotions titles retired a legend of arsenal result
2022-05-08,yo looks nice nice to see that you are drawing some leagueoflegends champions now c
2022-05-08,leagueoflegends
2022-05-08,i am halfway through arcane and know nothing about leagueoflegends but i love the video gameness of the show everyone is unfairly attractive and all the settings are unbelievably cool like a book you wrote yourself as a teen filled with mary sue ocs and sweet gadgets and magic
2022-05-08,i love that everyone in the replies is demanding for a proper update for varus the varus love stands strong
2022-05-08,he won u lot loads of derbies and won leagues champions lg europa league scored a shit ton of goals he is a club legend if azpi is a club legend as ur fans say
2022-05-08,i guarantee you have only ever played leagueoflegends then
2022-05-08,m first having a trollpick mid so you have got to dodge and then having your midlaner take yuumi from you is so fun especially when she later on ints the entire game i love leagueoflegends
2022-05-08,five leagueoflegends characters we would love to see in
2022-05-08,monster hunter genu celeste elite dangerous pokemon ruby final fantasy team fortress dark souls payday leagueoflegends super mario sunshine
2022-05-08,leagueoflegends
2022-05-08,just heard my friend playing leagueoflegends rage turn off the game and start laughing like a minute later leagueoflegends sucks the happiness out of people
2022-05-08,you would think a small indie company like leagueoflegends would at least have their client figured out
2022-05-08,is funsmith a playable champion in leagueoflegends or it only exists in legends of runeterra
2022-05-08,going live with some leagueoflegends before the wwe ppv tonight come stop by and say hi followers from affiliate
2022-05-08,tinder has a leagueoflegends tag ahaha
2022-05-08,yo thanks for helping me climb all the way to gold in leagueoflegends
2022-05-08,best leagueoflegends game i have ever had and this is just before elections starts thank you guys for making me forget my anxiety even just for a moment
2022-05-08,leagueoflegends video post valorant a strategy game that gives instructions to soldiers in real time click the link below to watch now
2022-05-08,they are in a much better place now may their souls rest in peace thank you very much for the support really means a lot big hugs
2022-05-08,pls nexus raid mod
2022-05-08,wrong
2022-05-08,one of the things i love about dota is ability draft it would be fun to play it in league someday
2022-05-08,at this current time i have found out i own every emote in leagueoflegends all of them
2022-05-08,what do you know about heights you always seem to be looking down what can we even look up to from your perspective
2022-05-08,it has to be said which one of u plays leagueoflegends
2022-05-08,top right corner makes me think blue essence
2022-05-08,it is up to the creators of the show who have confirmed it
2022-05-08,learning how to play mid in leagueoflegends come watch and give me some tips cause i be bad
2022-05-08,vvl vs awkwards h leagueoflegends
2022-05-08,reddit was created so i could go into the comments section and post bad leagueoflegends metagame takes someone gets pissed and flames me and says why i am wrong and then that person gets downvoted by the hivemind
2022-05-08,if you ever think your ideas are weird know that i wrote a fanfic where i mixed dragon age with leagueoflegends when i was so yea
2022-05-08,leagueoflegends ft
2022-05-08,isn t queuing up for a game of leagueoflegends already a wrong decision
2022-05-08,leagueoflegends event
2022-05-08,un popular opinion leagueoflegends is sort of too difficult i ts kind of like it was thought up by a guy who still lives with his parents
2022-05-08,leagueoflegends new grindr
2022-05-08,all of these require previous work in leagueoflegends besides talent management organized timely responses detail oriented important basic knowledge of spreadsheets must have open availability from may august to must be available first week of july
2022-05-08,looking to hire a few roles entry level paid contracted position leagueoflegends na broadcast production assistant content coordinator broadcast talent management tournament ops midwest only see below for details please dm with the role if interested
2022-05-08,arcane leagueoflegends
2022-05-08,this has some leagueoflegends vibes
2022-05-08,omori stellaris final fantasy the last of us halo monster hunter world or genu idk fire emblem three houses skyrim leagueoflegends hurts but it is true minecraft
2022-05-08,earned psn trophies bronze in ruined king a leagueoflegends story
2022-05-08,it s not up to you
2022-05-08,leagueoflegends corruption the things he does for me
2022-05-08,i lost it a long time ago i play leagueoflegends daily xd
2022-05-08,just riot being woke
2022-05-08,state champions as our esports team captured state championships in super smash brothers and leagueoflegends congratulations on this incredible accomplishment in your inaugural year
2022-05-08,i cannot found the updated version of the splash art
2022-05-08,hi champ you had a fantastic season we would not of won the league without you you are loved by everyone a massive congratulations on finally getting your winners medal legend and cannot wait to see you back on the pitch
2022-05-08,can we just have a leagueoflegends with all this cool stuff in it thanks
2022-05-08,prerry sure my pic from march was not on your leagueoflegends timeline w man
2022-05-08,nice work
2022-05-08,for a really reduced price i will link your leagueoflegends account to prime gaming
2022-05-08,leagueoflegends and val
2022-05-08,yeah it is called leagueoflegends
2022-05-08,anyone ever caught cheating in a competitive game should be banned from those and similar competitions for life no exceptions
2022-05-08,i am pretty sure beckham is classed as a legend caps plenty of trophies played at some of the best clubs in the world saved major league soccer of the other guys are pretty good at american sports and the rd guy drives a car
2022-05-08,lennydarkcloud now streaming leagueoflegends
2022-05-08,arena of valor similar to leagueoflegends but a lot simpler and on mobile
2022-05-08,cflaa fund the showtime legendary collection has partnered with many legends own a piece of league history with your limited edition legendary digital trading cards
2022-05-08,logicool g lol k da pro leagueoflegends gx lightsync rgb
2022-05-08,i am high asl n i wanna play bad can unban me i am tranna run it up i will stop cussin them trash people out
2022-05-08,check out this leagueoflegends clip i recorded with
2022-05-08,pls can you to put back the raid of nexus mod i love it
2022-05-08,she is neeko a character from leagueoflegends
2022-05-08,i was going crazy on mobile
2022-05-08,with these losers players we never win a premier league and champions league no quality united must change everything ten hag must do as guardiola did with the city by replacing renewing and taking full powers beyond that is the destruction of the united legend
2022-05-08,leagueoflegends
2022-05-08,mines a video game very specifically leagueoflegends can t really seem to get away from it the lore tft etc and anytime i go back to it i have to get really good again thankfully i can make time for it but you know it would be better if it was like coding
2022-05-08,lol leagueoflegends
2022-05-08,so basically what happened is that a leagueoflegends coach by the name of iridiell from the team empireclubeu insulted the entire lobby in a game and after i confronted them with the fact that their behavior is hurtful towards others they started dodging questions and
2022-05-08,day olaf leagueoflegends
2022-05-08,it a gif but u can see real video with ultra example for new roster league of legend
2022-05-08,leagueoflegends
2022-05-08,leagueoflegends
2022-05-08,i hate jhin leagueoflegends
2022-05-08,live now on leagueoflegends
2022-05-08,what is this thing and why is it on my leagueoflegends timeline
2022-05-08,live now for some leagueoflegends and ber it s saturday night morgana main
2022-05-08,leagueoflegends ha that is so funny i used to play that game until this one game where i was playing top lane as attrox vs urgot counter picked but managed to get the first kill and bought cull on free recall then my shaco jungle died ganking bottom typed lol then quit
2022-05-08,someone near me is playing enemy by imagine dragons jid arcane and leagueoflegends
2022-05-08,i have said it before premier league stats are both lazy journalism and they are an attempt to erase legends of the game add cl stats to that as well while we are at it
2022-05-08,leagueoflegends
2022-05-08,league of legend
2022-05-08,i had months to get in shape work on my mental health and fix my life and instead i played leagueoflegends
2022-05-08,sunday stream quickie leagueoflegends test
2022-05-08,i swear if this leagueoflegends music festival thing is real and they introduce a new group or artists i will cry if jinx is in the music world
2022-05-08,leagueoflegends video post valorant a strategy game that gives instructions to soldiers in real time click the link below to watch now
2022-05-08,leagueoflegends is greater than
2022-05-08,naur which wench from the past is trying to reach me through leagueoflegends of all places
2022-05-08,bro hes the highest goalscorer in history of sunday league football hes a legend jude will never outscore his sl career goals lmao
2022-05-08,leagueoflegends
2022-05-08,leagueoflegends
2022-05-08,i am now streaming on twitch playing leagueoflegends
2022-05-08,pov you are about to sit down to play leagueoflegends and climb
2022-05-08,ok i honestly did not expect to want a title so much
2022-05-08,leagueoflegends an interesting image has been circulating among aunt mohteryoshka s whatsapp group and it seems to be pool party seraphine she said she is uncertain of it and will investigate further but so far it seems to be oddly accurate to the actual design
2022-05-08,check out my play recorded by desktop app for
2022-05-08,bro you get what i mean my point was he did not win champions league trophies or played a big role in the two prems obviously he played a massive role in the cup winners cup and fa cups the point i was trying to make is you do not need to have loads of trophies to be a legend
2022-05-08,yorick things recorded by desktop app for
2022-05-08,the two worst leagueoflegends players you will ever meet
2022-05-08,hey hear me out fighters for project l in the shadows of darkness a ninja is molded by the lives they take either for granted or in earnest balance has no place for the one who kills to kill again zed please and thanks
2022-05-08,sergio aguero today received a description update on fut in the database a legend of the premier league era end of an era
2022-05-08,milan s salary cap is around m half of what inter and juve has and they are winning the league it is possible when you do not whine and do not be a stepping stone club big props to this legend too
2022-05-08,if riot made aatrox simp for kayle they can make varus gay
2022-05-08,league of leends
2022-05-08,just another day on leagueoflegends lmao
2022-05-08,leagueoflegends can burn for all i care
2022-05-08,who do u think the hottest yordle in leagueoflegends is
2022-05-08,league of legend mdr
2022-05-08,leagueoflegends
2022-05-08,i would prob go off which games pulls the most money and viewership because in that case prob gta and leagueoflegends
2022-05-08,katarina leagueoflegends
2022-05-08,leagueoflegends l k while in a deep datamine from aunt motheryoshka she found isolde s model in the genshin impact files it appears riot games tried to hid it in there until her release but aunt motheryoshka was not dumb to fall for it below you can see a render of her
2022-05-08,the world
2022-05-08,legends of runeterra does a much better job and showcases alot more rep than base league but in terms of lol the amount is growing but still relatively small and mostly relegated to the female castm
2022-05-08,bye leagueoflegends may no one remember you
2022-05-08,i only want to play leagueoflegends when i want to feel like a cis white man
2022-05-08,also plays leagueoflegends hopeless romantic plays video games doesnt have time for bs dont ask me for money im not a sugar daddy and im not gunna pay your bills please be responsible and pay your own im in this for the relationship i am a dom male looking for my submissive
2022-05-08,i personally prefer erl leagueoflegends rules about roster
2022-05-08,opens leagueoflegends
2022-05-08,leagueoflegends ranked funny moments and chats
2022-05-08,high noon varus skin spotlight league oflegends
2022-05-08,high noon katarina skin spotlight league oflegends
2022-05-08,prestige high noon talon skin spotlight league oflegends
2022-05-08,fuck micro macro and global because i hate economics as much as i hate leagueoflegends
2022-05-08,the urge to get leagueoflegends
2022-05-08,i love how they mention mf aswell both still did not get anything
2022-05-08,say leagueoflegends or some shit they never question it
2022-05-08,leagueoflegends
2022-05-08,pls remove sion from the game or rework his ultimate it s literally impossible to win games when there is always some fucking sion players who just run it down go but oneshot turrets nice champion
2022-05-08,going live with some leagueoflegends been a while since i last played so go easy on me okie
2022-05-08,bloodmoon cosmic dark star and project i guess
2022-05-08,congrats on a win here is lp also why did you lose that game i am deducting you lp wonder why so many players flame during ranked games
2022-05-08,i just found out there people out there looking for girlfriends boyfriends in video games like leagueoflegends pubg mobile legends and etc
2022-05-08,hyun s leagueoflegends stick figure spotlights are insane
2022-05-08,logicool g lol k da pro leagueoflegends gx lightsync rgb
2022-05-08,maybe not too sure
2022-05-08,is it so hard to bind ip block vpns make placements based on cs min or anything that will stop this cancer ruining the game for other people playing it
2022-05-08,yeah their music is pretty bad
