Datetime,Text
2022-05-08,lmaoo for the sake of every other team in the premier league i hope united legends keep giving advice and unsolicited help to the board and team
2022-05-08,what videogame would you like to star in omg leagueoflegends hands down if you could dress me in these sexy fits and furry tails i am down i admire cosplayers for investing hours and hours to achieve these loo
2022-05-08,like it or not premier league legend hall of famer
2022-05-08,i would say it is anyone who takes on the role of mom like a single dad maybe a grandparent or a foster parent maybe even an older sibling
2022-05-08,what is a mom type bim confused
2022-05-08,nd one without her for me and i miss mine too big hugs
2022-05-08,valorant abs leagueoflegends
2022-05-08,that is because you never dream of wining the quadruple or the chamions league or the premier league or the cup in fact as a spurs fan you dont expect to win anything this why you dont understand why we are upset we have a chance to be legends you just exist
2022-05-08,thinking kawhi cannot be a great defender when one of the best offensive players in the league s whole ass strategy is get him tf off me so i can score is a crazy hill to die on
2022-05-08,is a fair and balanced game
2022-05-08,sweetheart seraphine
2022-05-08,on radiomaxmusic enemy from leagueoflegends by imagine dragons listen now gt
2022-05-08,when the guy at the er asked me if i had anyone i could contact when i was still like zooted out i told him like times that i have no friends and i play leagueoflegends
2022-05-08,let me get the riot gun buddy tweedlede
2022-05-08,good morning family
2022-05-08,kc crowned kc legends red is the usys midwest conference premier ii champions red rolled to the league title with a long list of accomplishments goals scored goal given up goal differential shutouts avg goals per game
2022-05-08,arcane is so good i wish leagueoflegends was a game that existed
2022-05-08,anime is fun af rn leagueoflegends is dead af and teamfight tactics is just a waiting room rn valorant is rage inducing and being a gamer boy is mid
2022-05-08,yoo v dawgs birthday and mother s day
2022-05-08,logicool g lol k da pro leagueoflegends gx lightsync rgb
2022-05-08,xgp is less expensive than paying a single game on the steam digital store unless people play candy crush or leagueoflegends shovelware
2022-05-08,play leagueoflegends plz
2022-05-08,good morning with my irelia
2022-05-08,is anyone gonna talk about how clotted cream cookie is literallt evelynn leagueoflegends
2022-05-08,chinese tiktok leagueoflegends street
2022-05-08,leagueoflegends
2022-05-08,my legend kept newcastle up and took chelsea to the champions league something arteta is only just about to achieve meanwhile your legend henry was kicked out before the end of a season when he tried to coach
2022-05-08,if they do not let vladimir be in the leagueoflegends boyband i will personally come to m rc m rrill s house and redacted
2022-05-08,msipvb vs ig leagueoflegends msi
2022-05-08,leagueoflegends new emotes update panels good vibes only
2022-05-08,still so terribly upset that leagueoflegends is not entertaining to me as a game cause i really enjoyed arcane
2022-05-08,would you like to talk about leagueoflegends maria
2022-05-08,i play leagueoflegends tft valorant
2022-05-08,yes
2022-05-08,average leagueoflegends player
2022-05-08,mom types
2022-05-08,best mother in league
2022-05-08,a lot of friends play it never really got into it just been clawing my eyes out since i got back into leagueoflegends
2022-05-08,is not varus the bow
2022-05-08,mommy
2022-05-08,r i p my beautiful flower rd mother day without you god bless all the living mothers and their sons and daughters
2022-05-08,gaming industry is rampant with sexism prejudice and homophobia leagueoflegends pro biofrost speaks up about issues in esports sportskeeda
2022-05-08,hoping that some of these do better than your lane opponent challenges also work in jg maybe not this one but would be nice
2022-05-08,this might actually get me to give league another fair shake at regular play
2022-05-08,type this in the all chat of your leagueoflegends game and thank me later i
2022-05-08,can t be friends we re gonna have to be more than friends we re gonna have to beleagueoflegends duo partners
2022-05-08,please elosanta just do it please i m at my last straw
2022-05-08,varus was my first main but damn he needs a lore lines update because they do not fit each other anymore xd happy b day tho
2022-05-08,i get that people want asus of their favorite champs but im pretty sure there are champions that need it more then varus
2022-05-08,go king
2022-05-08,i play leagueoflegends
2022-05-08,it s a leagueoflegends sub league in europe for french teams
2022-05-08,releade his game
2022-05-08,happy mother s day to all the mothers at riot
2022-05-08,a new special shirt in the name of the legend sergio aguero with the title the moment of the historic goal that decided the premier league against qpr
2022-05-08,what is a mom type
2022-05-08,can you wish reksai a happy mother s day
2022-05-08,happy mothers day to leona
2022-05-08,another inspirational performance by biniam ghirmay biniam misses podium by slightest of margins to snatch th place in today s rd stage of th giro d italia won by cavendish bini is steadily climbing up z ladder of leagueoflegends
2022-05-08,near or far sending hugs to all the moms and mom types today
2022-05-08,remember to vote for the right leaders tom we re gonna have our national elections tom lt arcan gt caitlyn kiramman first test photo no weapon yet p
2022-05-08,then just play leagueoflegends
2022-05-08,i hate leagueoflegends
2022-05-08,is there a drive or a discord for leagueoflegends blender models
2022-05-08,hello as the person with the most followers on your app please add msi for leagueoflegends on may th i promise to be gentle
2022-05-08,yeah lol
2022-05-08,hi i am playing leagueoflegends ranked on stream right now come watch me be bad hehe
2022-05-08,hi i am playing leagueoflegends ranked on stream right now come watch me be bad hehe
2022-05-08,i would save fortnite and minecraft i do not know wtf elden ring is rocket league is boring have not played any halo game before apex and valorant are pretty fun but not really interesting enough never played leagueoflegends and gta is not my type of game
2022-05-08,leagueoflegends video post valorant a strategy game that gives instructions to soldiers in real time click the link below to watch now
2022-05-08,friend click this will surprise you every time batuhuhu and leagueoflegends
2022-05-08,leagueoflegends the mid season invitational ft will kickstart on may th
2022-05-08,if you would like them with the leagueoflegends character tell me which one if not i can just find something really nice for them and their names please
2022-05-08,pov uninstalling leagueoflegends
2022-05-08,just leagueoflegends
2022-05-08,whens my man getting a visual and voice update
2022-05-08,terraria leagueoflegends super animal royale stick fight the game roblox osu brawlhalla minecraft bloons td paintthetoolred
2022-05-08,wow thanks leagueoflegends player
2022-05-08,i am live over on playing leagueoflegends badly then games later
2022-05-08,i play leagueoflegends i be like that hahahahhahahahah
2022-05-08,if you lower damage then you will take more times killing minions poor aatrox and the towers also junglers will be heavily weakend aswell cause they will need way more time to clean the jungle
2022-05-08,at least i do not play leagueoflegends
2022-05-08,it s always the adc filth
2022-05-08,d print models jinx chitubox leagueoflegends
2022-05-08,twitch leagueoflegends
2022-05-08,happy mother s day leagueoflegends aram with friends pull up a chair and say hello
2022-05-08,imo the weekend days go on either end of the week so sun at the start and sat at the end
2022-05-08,glazers are allowing too many of your legends old heads to have influence on the club y all should have offloaded pogba by now when his value was higher and went after more premier league proven defenders after mcguire was proven to be not him
2022-05-08,and who the fuck are you lmao
2022-05-08,i played the game since the beta im bored in this game
2022-05-08,rare leagueoflegends esports w
2022-05-08,please at least give him voice lines or something he is trapped between two identities
2022-05-08,congrats to the esports team that finished as class a runnerup in leagueoflegends state esports finals on saturday we are proud of your efforts
2022-05-08,i love leagueoflegends
2022-05-08,i think theres a certain time period where you can claim them like only within the first week as far as i know lmk if im wrong tho
2022-05-08,thank god aram is the true competitive mode
2022-05-08,leagueoflegends wild rift live
2022-05-08,it s been years since the music video and still no new vo
2022-05-08,league of legend ahri
2022-05-08,uhh he still has his wife and his kids
2022-05-08,leagueoflegends crimson raptor and raptors how to make crimson raptor cosplay
2022-05-08,as we fall came out in and his voice lines still are the same from please update this boy
2022-05-08,he they should also get a model update animations maybe
2022-05-08,is there really like a point to this like do you get anything out of it
2022-05-08,voice update when
2022-05-08,leagueoflegends and it is ranked matchmaking is so fucking trash absolutely atrocious and disgusting fuck you riot
2022-05-08,this week americans thinking that the week starts off with sunday is the weirdest thing
2022-05-08,my friend cannot escape the curse of leagueoflegends after all
2022-05-08,leagueoflegends top streams a las hora esp kxmiviewers attilaviewers javierrlolviewers
2022-05-08,enemy von imagine dragons feat jid and leagueoflegends
2022-05-08,happy birthday gay shadow man
2022-05-08,leagueoflegends is such a buggy game it says defeat on my screen
2022-05-08,i will gladly be shaking my ass on the devils lap
2022-05-08,all random all flawless
2022-05-08,i do not speak spanish but ornn skin when
2022-05-08,how s smite doing now i use to play a crap ton back in highschool kinda dropped it for leagueoflegends
2022-05-08,leagueoflegends
2022-05-08,game of legends
2022-05-08,are you a jinx main
2022-05-08,veigarv will post a min video about the most everyday leagueoflegends game ever including some feeder and be like cant believe this is happening to me
2022-05-08,do i look like i know i never mentioned nor asked u anything lol
2022-05-08,league of legend
2022-05-08,varus asu and new voice over when he deserves the asu far more than ahri
2022-05-08,leagueoflegends
2022-05-08,never played this
2022-05-08,okay but where is varus s asu it is been years
2022-05-08,leagueoflegends chill en ch points gamble bet redeemlist
2022-05-08,we need another darkin champ
2022-05-08,mike be a euroleague legend do not go back to disney league of hypocrisy
2022-05-08,msi de leagueoflegends bet odds t rng g eg psg wildcats dfm buffalo aze red order
2022-05-08,happy mothers day playing leagueoflegends to celebrate
2022-05-08,lets see if i have still got it leagueoflegends
2022-05-08,no im singing get jinxed from leagueoflegends
2022-05-08,which of the guys should i be wishing a happy birthday to be exact
2022-05-08,varus is just ashe with a dick and gay like who cares
2022-05-08,exactly i do not mind characters getting a lot of skins as long as they do not forget the other legacy characters i mean leblanc is hella popular but no legendary skin
2022-05-08,may stream schedule monday am noon ranked leagueoflegends thursday am pm walking dead a new frontier friday am pm ranked leagueoflegends tv bsolo
2022-05-08,isn t that one of ashe s voice lines
2022-05-08,good now make champion specific eternals free and we will be gucci
2022-05-08,i hope these challenges are used to better matchmaking
2022-05-08,leagueoflegends
2022-05-08,what do you think love leagueoflegends visit us com
2022-05-08,just checked how much i have spent on both valorant and leagueoflegends and i have given over of my hard earned money to fuckass riot games
2022-05-08,with the last skins
2022-05-08,ah yes the non gay character you put two gay guys on and then hid them giving us no voiceover update or any in game reference to them varus is a representation of homophobia because cannot make playable gay men
2022-05-08,thank you finally something is done the current state of league feels like a bastardization of what it used to be i hope we can bring it back to more tactical extended fights games dont have to be mins stomp fests minutes is the best imo with intense lategame
2022-05-08,pls urf or arurf
2022-05-08,i do spend hours on discord though but i have never played leagueoflegends in my life
2022-05-08,prime gaming is not letting me collect may reward
2022-05-08,leagueoflegends crimson raptor and raptors i try crimson raptor cosplay
2022-05-08,so asexual love that
2022-05-08,more in game money i suppose
2022-05-08,thebaus real challenge
2022-05-08,of course they can but thats just wishful thinking
2022-05-08,c mon launch already
2022-05-08,are there any rewards we are getting for completing those challenges
2022-05-08,live depuis moins de h leagueoflegends call of duty modern warfare valheim
2022-05-08,win lane lose the game
2022-05-08,and senna
2022-05-08,how long it would take for you to spend five nights with some bitches by using your ip address i found out you play leagueoflegends not only that but you also spend over hours a day on discord knowing this i derived a formula to calculate the answer to my
2022-05-08,nu op ztack enemy from the series arcane leagueoflegends van imagine dragons jid and leagueoflegends tune in op
2022-05-08,do not care we want madison beer to come back for kda
2022-05-08,leagueoflegends ranked jungle and adc starting to grind
2022-05-08,mans had you watching their leagueoflegends streams
2022-05-08,darkins got no sexuality at all so hes neither straight or gay darkins only care for two things war and destruction they are demons of war
2022-05-08,win lane win game challenges launch this week more info
2022-05-08,wanted to destroy rekkles hylissang humbled him reflections with upset leagueoflegends
2022-05-08,league of legend
2022-05-08,my mains bday
2022-05-08,varus could honestly be a fantastic character with the lore you setup for him sucks that you have done nothin with it
2022-05-08,is this becouse of the dignitas icon
2022-05-08,leagueoflegends video post valorant a strategy game that gives instructions to soldiers in real time click the link below to watch now
2022-05-08,i am thinking anyone who puts league of legend player on their profile probably is a virgin and need to get out more to experience the real world
2022-05-08,leagueoflegends
2022-05-08,and is the signal of different and immortal of different league which was suddenly stopped by unfortunate incident we will always miss in our life legend sidharth shukla
2022-05-08,honestly visual only would be fine i do not feel like his gameplay needs to change but he clearly needs new vo and vfx sfx and animations
2022-05-08,they re from arcane on netflix which is based on leagueoflegends video game
2022-05-08,can u please bring back pretty please
2022-05-08,views from sirchez streams leagueoflegends
2022-05-08,i have seen nuclear test sites less toxic than leagueoflegends your cooch probably growl
2022-05-08,lore varus or game varus right now they are completely different
2022-05-08,he needs a
2022-05-08,he also has never been confirmed to be straight either but with gays inside him you never know
2022-05-08,pls do not bruh me and second of all as a full home grown asian in asia yes riot can everything will be censored over asian servers the short story about leona and diana was literally cut clara and ophelia vladimir s students were also cut
2022-05-08,went to a party last night a girl i spoke to was really nice but she clocked me unprompted as a gamer a streamer plays support on leagueoflegends submissive got bullied in highschool she brought all these assumptions up on her own my god she was right tho
2022-05-08,well then china should grow up
2022-05-08,one of my favorite adr happy birthday varus
2022-05-08,he doesnt respect me so i will not either
2022-05-08,tsm reginald investigation one of the big leagueoflegends team owners is in the middle of a scandal about being a giant jerk and bully tsm reginald lol leagueoflegend games espo
2022-05-08,images to scare leagueoflegends players
2022-05-08,kayn use they them
2022-05-08,he is a flop
2022-05-08,explain pls
2022-05-08,imagine dragons jid arcane leagueoflegends enemy feat j i d from the series arcane leagueoflegends tune in at
2022-05-08,cant have that in china bruh
2022-05-08,he has two gay guys inside of him doesnt make him gay varus wanted to consume their bodies to resurrect himself from being prisoned besides demons that care about war and destruction doesnt have sexuallity
2022-05-08,let us play leagueoflegends sometimes
2022-05-08,leagueoflegends unranked ranked climb
2022-05-08,con sucks at leagueoflegends
2022-05-08,he literally has a gay couple inside of him i can assure you they talk all day long also varus is thousands of years old nobody stays straight for that long
2022-05-08,don t you mean vaarus
2022-05-08,i am really trying my best to play leagueoflegends again but holy heck still a super toxic game
2022-05-08,varus never been confirmed gay aside from two gay guys stuck inside him
2022-05-08,why are all the replies from you mf why are you so obsessed with some pixels
2022-05-08,been waiting a long time to use this
2022-05-08,varus himself isnt gay tho
2022-05-08,update him and don t be shy give taric a skin
2022-05-08,theres atleast
2022-05-08,i genuinely just wanted to jokingly make fun of someone who played leagueoflegends it was the other guy who brought my beliefs into it
2022-05-08,waow you are such a responsible leagueoflegends member of community i am so happy that you are turning into the face of lol riot pls fix this
2022-05-08,okay i will show domes facts voted trump furloughed staff tried to a copyright liverpool super league increased ticket prices flew one of our legends to usa just to sack him have never fully backed klopp when he needed them most doesn t invest in the woman s team
2022-05-08,going with the flow today starting with some leagueoflegends pubg more vampire br and other games come drop by live all day long live now
2022-05-08,ok now make his asu happen it is been years of game and years of promises changes this awful of model and give us some actual gay representation in his voicelines we tired of asking for the bare minimum
2022-05-08,you turn into a computer i see lemme look at these files oh my god i click the file and when it boots up leagueoflegends
2022-05-08,biofrost comes out leagueoflegends pro player comes out gay sounds like he is had a hard time of it biofrost lol leagueoflegends games lgbt homophobia gay
2022-05-08,streamek
2022-05-08,i created new channel where i will post daily shorts from leagueoflegends leaks news fun and more
2022-05-08,happy birthday darkin with no double a but double humans
2022-05-08,i really wish it was not leagueoflegends but would definitely be league
2022-05-08,what we know about leagueoflegends next hero bel veth games news now
2022-05-08,what we know about leagueoflegends next hero bel veth
2022-05-08,happy birthday now give him an update
2022-05-08,leagueoflegends is so fake out here saying happy birthday to varus no don t wish him a happy birthday until you remember he is a champion that exists that you have ignored for years since his lore update
2022-05-08,sauce needed
2022-05-08,years already
2022-05-08,he needs identity
2022-05-08,love her i want this so much for her
2022-05-08,update him please he needs a vgu minimum new skin do nothing to help him when he still looks like he s meant to be some weird void guy
2022-05-08,rectification i just realized how good france is at leagueoflegends
2022-05-08,anime valorant leagueoflegends gf
2022-05-08,you gave him one of the richest lores in the game but you just threw it out to waste he is handsome funny and has a couple constantly arguing inside him the potential is huge give him the attention he fucking deserves
2022-05-08,session leagueoflegends ranked main adc discord
2022-05-08,negro league legend norman turkey stearnes was born in nashville cool papa bell said if turkey is not in the hall of fame then no one deserves to be in the hall of fame he was enshrined in cooperstown in
2022-05-08,a fuckin men
2022-05-08,winrate trash negative pickrate champion you did amazing job with him
2022-05-08,ey rito you can do a bit more than the absolute minimum and give him an asu only darkin that do not look like a darkin
2022-05-08,imagine dragons jid arcane and leagueoflegends enemy
2022-05-08,csleagueoflegends wild rift wjcw
2022-05-08,they should do the same for smash leagueoflegends and valorant players
2022-05-08,top video game characters that are not in leagueoflegends
2022-05-08,it s time furien is live playing leagueoflegends
2022-05-08,it is sad because you make a whole music video and two comics to change his lore and make him attractive to new players but when they get to the game it is just a big let down it just pushes players away every single skin the devs are limited and the fans are never satisfied
2022-05-08,shieda kayn leagueoflegends s
2022-05-08,why do i keep seeing pictures of cut outs of leagueoflegends players on beaches
2022-05-08,if u did put only of the effort is given in legendaries for ez ahri leona or lux on something good for varus we would not have to humiliate ourselves under every single rioter tweet asking for the damn bare minimum just give him an asu everybody wants it
2022-05-08,do you guys will ever bring back odyssey after urf that is the best game mod ever
2022-05-08,no you do not get to come here and wish him a happy birthday when his in game model is this yo piece of trash and his voicelines are extremely outdated it s been years since you promised us a asu and still nothing we want you to give us what we deserve and we want it now
2022-05-08,i lost games of leagueoflegends for this via
2022-05-08,wich varus
2022-05-08,look i have never played leagueoflegends and even this being league mobile and me just starting the game but damn this was an intense game lol we were like down on kills at one point
2022-05-08,world of warcraft hearthstoneblizzardmobat leagueoflegends
2022-05-08,riot just said love gays exciting people and then ignores all varus promises they made years ago
2022-05-08,great now update him
2022-05-08,leagueoflegends sa pc
2022-05-08,now gift him the new vo that has valmar and kai in it that you promised years ago
2022-05-08,pls riot make balance on aram i mean mage champs and supp champs are so usules there when asasins and tanks are too op make them all to do same damage like on summ rift map ty
2022-05-08,still needs another a
2022-05-08,don t you dare mention his name when you have him on the streets for the past years
2022-05-08,lezgoo depressed leagueoflegends gamers for leni
2022-05-08,leagueoflegends specifically the clip came from one of their cinematics and the sound clip is of nocturns ulti who is also show on screen
2022-05-08,trashcan
2022-05-08,i wonder sometimes how many gay images you have in your phone
2022-05-08,dark star for sure
2022-05-08,now morph can waveform to leagueoflegends
2022-05-08,bronze monkas
2022-05-08,have a nice day
2022-05-08,please give him a lore update his story is so damn cool but he barely fits in with the other darkin
2022-05-08,happy birthday king
2022-05-08,hahaha thanks bro good day to you
2022-05-08,oh yes ty i imagine that too
2022-05-08,hb varus
2022-05-08,i would but he missed the memo
2022-05-08,huh
2022-05-08,it d be cool if his w active damage got multiplied by crit chance like xayah s e does that way crit varus invests his gold in the fun part of his kit big snipes instead of just attacks
2022-05-08,rankeando leagueoflegends
2022-05-08,when will you update his voice its been like years since lore change
2022-05-08,happy bday now give him his well deserved model and vo update the man still mourns the death of his wife he doesnt have anymore since you changed the lore unless yall dont remember cause you made it gay
2022-05-08,meh been on fiddle more so
2022-05-08,lets go mr trashcan
2022-05-08,this june will be a good chance to update his voice babes we need some good gay relationship representation
2022-05-08,hbd to our gay darkin plus kai and valmar
2022-05-08,what we know about leagueoflegends next hero bel veth esports
2022-05-08,its just win after win for you
2022-05-08,twitch leagueoflegends
2022-05-08,its the patroa
2022-05-08,also varus is my good adc replacement if others failed
2022-05-08,happy birthday
2022-05-08,how did i miss this
2022-05-08,happy mother s day to my mom who still loves me even after i do shit like get a leagueoflegends tattoo
2022-05-08,when is his vo update
2022-05-08,sininfor the love of goodnes ohmygsollmfnnfnfnrbbsjg
2022-05-08,awesome champ
2022-05-08,one piercing arrow can land a retribution the guilty will know agony
2022-05-08,more yasuo x riven please
2022-05-08,stream alert winding down after a busy weekend tune in to as she chills with some marbles on stream and leagueoflegends
2022-05-08,no i do not think i will
2022-05-08,oh wow no accidental leaks this year j
2022-05-08,the darkin or the lovers lol
2022-05-08,eat my ass riot games
2022-05-08,have u ever played leagueoflegends while watching anime and thinking of valorant cause same gt
